{
  "schemaVersion": "1",
  "knowledgeBase": "docs",
  "generation": {
    "name": "generation-7",
    "commit": "0123456789abcdef0123456789abcdef01234567",
    "spec": "0.2",
    "contentDigest": "dddddddddddddddddddddddddddddddddddddddddddddddddddddddddddddddd",
    "checks": ["Knowledge Eval", "Verify"]
  },
  "access": {"profile": "support", "agents": ["support-agent"], "teams": ["support"], "useCases": ["customer-support"]},
  "policy": {
    "minimum_trust": "machine-confirmed",
    "allow_stale": false,
    "allowed_statuses": ["stable"],
    "require_sources": true
  },
  "revision": {
    "specVersion": "0.2",
    "indexSha256": "eeeeeeeeeeeeeeeeeeeeeeeeeeeeeeeeeeeeeeeeeeeeeeeeeeeeeeeeeeeeeeee"
  },
  "query": "rollback policy",
  "limit": 5,
  "results": [
    {
      "source": {
        "path": "operations/rollback.md",
        "id": "rollback#procedure",
        "locator": "okf+sha256://eeeeeeeeeeeeeeeeeeeeeeeeeeeeeeeeeeeeeeeeeeeeeeeeeeeeeeeeeeeeeeee/operations%2Frollback.md#bbbbbbbbbbbbbbbbbbbbbbbbbbbbbbbbbbbbbbbbbbbbbbbbbbbbbbbbbbbbbbbb",
        "contentSha256": "bbbbbbbbbbbbbbbbbbbbbbbbbbbbbbbbbbbbbbbbbbbbbbbbbbbbbbbbbbbbbbbb",
        "kind": "concept",
        "type": "Guide",
        "title": "Rollback",
        "heading": "Procedure",
        "lineStart": 12,
        "lineEnd": 20,
        "score": 9.5,
        "matches": ["title"],
        "relation": "direct"
      },
      "trust": {
        "tier": "human-reviewed",
        "status": "stable",
        "verified": [{"by": "human:reviewer", "at": "2026-08-20T10:00:00Z"}]
      },
      "freshness": {
        "stale": false,
        "staleAfter": "2027-12-31",
        "evaluatedAt": "2026-08-21T12:00:00Z"
      },
      "provenance": {
        "generation": {
          "name": "generation-7",
          "commit": "0123456789abcdef0123456789abcdef01234567",
          "spec": "0.2",
          "contentDigest": "dddddddddddddddddddddddddddddddddddddddddddddddddddddddddddddddd",
          "checks": ["Knowledge Eval", "Verify"]
        },
        "sources": [{"id": "runbook", "resource": "https://example.test/runbook"}]
      },
      "selection": {
        "rank": 1,
        "score": 9.5,
        "relation": "direct",
        "matches": ["title"],
        "reasons": ["rank:1", "trust:human-reviewed", "status:stable", "freshness:fresh", "relation:direct", "match:title", "provenance:sources=1"]
      }
    }
  ],
  "rejected": [
    {
      "id": "draft#top",
      "locator": "okf+sha256://eeeeeeeeeeeeeeeeeeeeeeeeeeeeeeeeeeeeeeeeeeeeeeeeeeeeeeeeeeeeeeee/draft.md#cccccccccccccccccccccccccccccccccccccccccccccccccccccccccccccccc",
      "path": "draft.md",
      "reasons": ["trust_below_minimum", "stale", "status_not_allowed", "sources_required"]
    }
  ],
  "decision": "answer",
  "refusalReasons": [],
  "issues": []
}
